{
 "$schema": "https://json-schema.org/draft/2020-12/schema",
 "title": ".gprv record, version 0.2",
 "description": "The structure of one .gprv record (spec gprv-0.1.md §4). Id uniqueness, reference order and the print step are checked by gprv.record.check (spec §9).",
 "type": "object",
 "required": [
  "gprv",
  "statement",
  "processStep"
 ],
 "additionalProperties": false,
 "properties": {
  "gprv": {
   "const": "0.2"
  },
  "statement": {
   "type": "string"
  },
  "source": {
   "type": "array",
   "items": {
    "$ref": "#/$defs/source"
   }
  },
  "processStep": {
   "type": "array",
   "minItems": 1,
   "items": {
    "$ref": "#/$defs/step"
   }
  }
 },
 "$defs": {
  "id": {
   "type": "string",
   "pattern": "^[A-Za-z_][A-Za-z0-9_.-]*$"
  },
  "sha256": {
   "type": "string",
   "pattern": "^[0-9a-f]{64}$"
  },
  "identifier": {
   "type": "object",
   "required": [
    "code"
   ],
   "additionalProperties": false,
   "properties": {
    "code": {
     "type": "string"
    },
    "codeSpace": {
     "type": "string"
    }
   }
  },
  "citation": {
   "type": "object",
   "required": [
    "title"
   ],
   "additionalProperties": false,
   "properties": {
    "id": {
     "$ref": "#/$defs/id"
    },
    "title": {
     "type": "string"
    },
    "edition": {
     "type": "string"
    },
    "identifier": {
     "type": "array",
     "items": {
      "$ref": "#/$defs/identifier"
     }
    },
    "otherCitationDetails": {
     "type": "array",
     "items": {
      "type": "string"
     }
    },
    "onlineResource": {
     "type": "array",
     "items": {
      "type": "object",
      "required": [
       "linkage"
      ],
      "additionalProperties": false,
      "properties": {
       "linkage": {
        "type": "string"
       }
      }
     }
    },
    "sha256": {
     "$ref": "#/$defs/sha256"
    }
   }
  },
  "hashedCitation": {
   "allOf": [
    {
     "$ref": "#/$defs/citation"
    },
    {
     "required": [
      "sha256"
     ]
    }
   ]
  },
  "source": {
   "type": "object",
   "required": [
    "id",
    "description"
   ],
   "additionalProperties": false,
   "properties": {
    "id": {
     "$ref": "#/$defs/id"
    },
    "description": {
     "type": "string"
    },
    "sourceCitation": {
     "$ref": "#/$defs/citation"
    },
    "sourceMetadata": {
     "type": "array",
     "items": {
      "$ref": "#/$defs/hashedCitation"
     }
    },
    "processedLevel": {
     "$ref": "#/$defs/identifier"
    },
    "scope": {
     "const": {
      "level": "software"
     }
    }
   }
  },
  "component": {
   "type": "object",
   "required": [
    "id",
    "description",
    "citation"
   ],
   "additionalProperties": false,
   "properties": {
    "id": {
     "$ref": "#/$defs/id"
    },
    "description": {
     "type": "string"
    },
    "citation": {
     "$ref": "#/$defs/citation"
    },
    "codeOrigin": {
     "$ref": "#/$defs/codeOrigin"
    }
   }
  },
  "processing": {
   "type": "object",
   "required": [
    "identifier"
   ],
   "additionalProperties": false,
   "properties": {
    "algorithm": {
     "type": "array",
     "items": {
      "anyOf": [
       {
        "$ref": "#/$defs/component"
       },
       {
        "$ref": "#/$defs/id"
       }
      ]
     }
    },
    "identifier": {
     "$ref": "#/$defs/identifier"
    },
    "softwareReference": {
     "anyOf": [
      {
       "$ref": "#/$defs/citation"
      },
      {
       "$ref": "#/$defs/id"
      }
     ]
    },
    "runTimeParameters": {
     "type": "object"
    }
   }
  },
  "report": {
   "type": "object",
   "required": [
    "name"
   ],
   "additionalProperties": false,
   "properties": {
    "name": {
     "type": "string"
    },
    "description": {
     "type": [
      "string",
      "object"
     ]
    }
   }
  },
  "output": {
   "type": "object",
   "required": [
    "id"
   ],
   "additionalProperties": false,
   "properties": {
    "id": {
     "$ref": "#/$defs/id"
    },
    "sourceCitation": {
     "$ref": "#/$defs/citation"
    }
   }
  },
  "step": {
   "type": "object",
   "required": [
    "id",
    "description"
   ],
   "additionalProperties": false,
   "properties": {
    "id": {
     "$ref": "#/$defs/id"
    },
    "description": {
     "type": "string"
    },
    "stepDateTime": {
     "type": "string",
     "pattern": "^\\d{4}-\\d{2}-\\d{2}T\\d{2}:\\d{2}:\\d{2}(\\.\\d+)?Z$"
    },
    "reference": {
     "type": "array",
     "items": {
      "$ref": "#/$defs/citation"
     }
    },
    "source": {
     "type": "array",
     "items": {
      "$ref": "#/$defs/id"
     }
    },
    "processingInformation": {
     "$ref": "#/$defs/processing"
    },
    "report": {
     "type": "array",
     "items": {
      "$ref": "#/$defs/report"
     }
    },
    "output": {
     "type": "array",
     "items": {
      "$ref": "#/$defs/output"
     }
    },
    "codeOrigin": {
     "$ref": "#/$defs/codeOrigin"
    },
    "executionContext": {
     "$ref": "#/$defs/executionContext"
    }
   }
  },
  "contentHash": {
   "type": "object",
   "required": [
    "algorithm",
    "covers"
   ],
   "additionalProperties": false,
   "properties": {
    "algorithm": {
     "enum": [
      "sha256",
      "sha1"
     ]
    },
    "value": {
     "type": "string",
     "pattern": "^[0-9a-f]+$"
    },
    "covers": {
     "enum": [
      "file",
      "directory",
      "distribution",
      "none"
     ]
    }
   }
  },
  "codeOrigin": {
   "type": "object",
   "required": [
    "kind",
    "source",
    "name",
    "contentHash",
    "license"
   ],
   "additionalProperties": false,
   "properties": {
    "kind": {
     "enum": [
      "repository",
      "package",
      "file",
      "archive",
      "service",
      "other"
     ]
    },
    "source": {
     "type": "string",
     "pattern": "^[A-Za-z][A-Za-z0-9+.-]*:\\S+$"
    },
    "name": {
     "type": "string"
    },
    "version": {
     "type": [
      "string",
      "null"
     ]
    },
    "contentHash": {
     "$ref": "#/$defs/contentHash"
    },
    "license": {
     "type": "string"
    },
    "citation": {
     "type": "string"
    },
    "editable": {
     "type": "boolean"
    }
   }
  },
  "executionContext": {
   "type": "object",
   "additionalProperties": false,
   "minProperties": 1,
   "properties": {
    "precision": {
     "enum": [
      "float32",
      "float64"
     ]
    },
    "backend": {
     "type": "object",
     "additionalProperties": false,
     "required": [
      "name"
     ],
     "properties": {
      "name": {
       "enum": [
        "fftw",
        "mlx",
        "cuda",
        "numpy"
       ]
      },
      "version": {
       "type": [
        "string",
        "null"
       ]
      },
      "planner": {
       "type": [
        "string",
        "null"
       ]
      },
      "binding": {
       "type": [
        "string",
        "null"
       ]
      }
     }
    },
    "fallback": {
     "type": "string"
    },
    "libraries": {
     "type": "object",
     "additionalProperties": {
      "type": [
       "string",
       "null"
      ]
     }
    },
    "platform": {
     "type": "string"
    },
    "thirdParty": {
     "type": "array",
     "items": {
      "type": "object",
      "additionalProperties": false,
      "required": [
       "component"
      ],
      "properties": {
       "component": {
        "$ref": "#/$defs/id"
       }
      }
     }
    }
   }
  }
 }
}
