{"gprv": "0.2",
 "statement": "A ridge filter from a user's devices folder applied to a synthetic field, with every kind of code origin a step can name.",
 "source": [
   {"id": "s1", "description": "A 256x256 synthetic fractional Brownian field, H = 0.6, seed 7.",
    "sourceCitation": {"title": "fbm_256.npz", "sha256": "9d4e0a0b3b7a7c1a0e5f2c9d8b7a6f5e4d3c2b1a0f9e8d7c6b5a4f3e2d1c0b9a"}}],
 "processStep": [
   {"id": "p1", "description": "Ridge filter: a user device found in the devices folder, run on the field.",
    "source": ["s1"], "output": [{"id": "d1"}],
    "codeOrigin": {"kind": "file", "source": "file:devices/ridge_filter.py", "name": "ridge_filter", "version": "0.3",
                   "contentHash": {"algorithm": "sha256", "value": "0b4f2d7e8a9c1b3d5f6e7a8b9c0d1e2f3a4b5c6d7e8f9a0b1c2d3e4f5a6b7c8d", "covers": "file"},
                   "license": "MIT", "editable": true},
    "processingInformation": {
      "algorithm": [
        {"id": "ridge", "description": "the ridge kernel, from the user's file",
         "citation": {"title": "ridge_filter", "identifier": [{"code": "ridge_filter.ridge", "codeSpace": "user"}]},
         "codeOrigin": {"kind": "file", "source": "file:devices/ridge_filter.py", "name": "ridge_filter", "version": "0.3",
                        "contentHash": {"algorithm": "sha256", "value": "0b4f2d7e8a9c1b3d5f6e7a8b9c0d1e2f3a4b5c6d7e8f9a0b1c2d3e4f5a6b7c8d", "covers": "file"},
                        "license": "MIT", "editable": true}},
        {"id": "fft", "description": "the FFT backend, an installed package",
         "citation": {"title": "pyFFTW", "edition": "0.15.0"},
         "codeOrigin": {"kind": "package", "source": "pypi:pyFFTW==0.15.0", "name": "pyFFTW", "version": "0.15.0",
                        "contentHash": {"algorithm": "sha256", "value": "1c2d3e4f5a6b7c8d9e0f1a2b3c4d5e6f7a8b9c0d1e2f3a4b5c6d7e8f9a0b1c2d", "covers": "distribution"},
                        "license": "BSD-3-Clause"}},
        {"id": "wtmm", "description": "the wavelet transform, pinned by its repository commit",
         "citation": {"title": "wtmm", "identifier": [{"code": "wtmm.cwt2d", "codeSpace": "geodynamix"}]},
         "codeOrigin": {"kind": "repository", "source": "git+https://github.com/MarioKartUltra/GeoDynamX@6194b86e5859cf5a4a0d68f8425b8ac8d86d2df8",
                        "name": "GeoDynamix", "version": "6194b86e5859cf5a4a0d68f8425b8ac8d86d2df8",
                        "contentHash": {"algorithm": "sha256", "covers": "none"}, "license": "GPL-2.0-or-later"}},
        {"id": "lw", "description": "the LastWave reference port, from a published archive",
         "citation": {"title": "LastWave 3.0", "identifier": [{"code": "10.1109/34.142909", "codeSpace": "doi"}]},
         "codeOrigin": {"kind": "archive", "source": "https://example.org/lastwave/lastwave-3.0.tar.gz", "name": "LastWave", "version": "3.0",
                        "contentHash": {"algorithm": "sha256", "value": "2d3e4f5a6b7c8d9e0f1a2b3c4d5e6f7a8b9c0d1e2f3a4b5c6d7e8f9a0b1c2d3e", "covers": "directory"},
                        "license": "GPL-2.0-only", "citation": "Mallat and Zhong 1992, doi:10.1109/34.142909"}},
        {"id": "geoid", "description": "a geoid height looked up from a remote service",
         "citation": {"title": "EGM2008 geoid service"},
         "codeOrigin": {"kind": "service", "source": "https://geoid.example.org/v2/height", "name": "egm2008-height", "version": null,
                        "contentHash": {"algorithm": "sha256", "covers": "none"}, "license": "NOASSERTION"}},
        {"id": "nb", "description": "a notebook cell pasted in by hand, hashed as text",
         "citation": {"title": "normalise cell"},
         "codeOrigin": {"kind": "other", "source": "urn:uuid:5d2a8f7e-1b3c-4d5e-9f6a-7b8c9d0e1f2a", "name": "normalise", "version": null,
                        "contentHash": {"algorithm": "sha256", "value": "3e4f5a6b7c8d9e0f1a2b3c4d5e6f7a8b9c0d1e2f3a4b5c6d7e8f9a0b1c2d3e4f", "covers": "file"},
                        "license": "NOASSERTION"}}],
      "identifier": {"code": "ridge_filter/run", "codeSpace": "user"},
      "softwareReference": {"id": "gdx", "title": "GeoDynamix", "edition": "6194b86e5859cf5a4a0d68f8425b8ac8d86d2df8",
                            "otherCitationDetails": ["python 3.12.13", "numpy 2.4.3"],
                            "onlineResource": [{"linkage": "https://github.com/MarioKartUltra/GeoDynamX"}]},
      "runTimeParameters": {"ridge": {"gain": 2.0}}}},
   {"id": "p2", "description": "Export: the filtered field written as a derived dataset.",
    "stepDateTime": "2026-10-15T14:30:00Z",
    "source": ["d1"],
    "output": [{"id": "o1", "sourceCitation": {"title": "code_origin.npz", "sha256": "4f5a6b7c8d9e0f1a2b3c4d5e6f7a8b9c0d1e2f3a4b5c6d7e8f9a0b1c2d3e4f5a"}}],
    "processingInformation": {
      "identifier": {"code": "fork", "codeSpace": "geodynamix"},
      "softwareReference": "gdx",
      "runTimeParameters": {"bands": ["ridge"]}}}]}
